{
  "version_esquema": "ModelQualityCase_v1",
  "generated_at_utc": "2026-02-20T06:38:06+00:00",
  "caso_id": "CASE_20260220_ACVA",
  "ticker": "ACVA",
  "fecha_caso": "2026-02-20",
  "coverage": {
    "votes_total": 6,
    "canonical_steps": 4,
    "per_model_entries": 4
  },
  "min_samples_per_step_model": 20,
  "per_model_step_stats": [
    {
      "canonical_step_name": "CATALYST_DETECTION",
      "backend": "claude",
      "n_votes": 1,
      "mean": 62.75,
      "p25": 63.0,
      "median": 63.0,
      "p75": 63.0,
      "last_seen_utc": "2026-02-20T06:38:06+00:00",
      "sample_sufficiency": false,
      "rules_failed_top": [
        {
          "rule": "schema_valid",
          "count": 1
        }
      ]
    },
    {
      "canonical_step_name": "CATALYST_DETECTION",
      "backend": "codex",
      "n_votes": 1,
      "mean": 100.0,
      "p25": 100.0,
      "median": 100.0,
      "p75": 100.0,
      "last_seen_utc": "2026-02-20T06:38:06+00:00",
      "sample_sufficiency": false,
      "rules_failed_top": []
    },
    {
      "canonical_step_name": "FORENSIC_DETECTION",
      "backend": "claude",
      "n_votes": 1,
      "mean": 65.63,
      "p25": 66.0,
      "median": 66.0,
      "p75": 66.0,
      "last_seen_utc": "2026-02-20T06:36:24+00:00",
      "sample_sufficiency": false,
      "rules_failed_top": [
        {
          "rule": "schema_valid",
          "count": 1
        }
      ]
    },
    {
      "canonical_step_name": "FORENSIC_DETECTION",
      "backend": "codex",
      "n_votes": 1,
      "mean": 99.48,
      "p25": 99.0,
      "median": 99.0,
      "p75": 99.0,
      "last_seen_utc": "2026-02-20T06:36:24+00:00",
      "sample_sufficiency": false,
      "rules_failed_top": []
    }
  ],
  "fusion_comparison": [],
  "_meta": {
    "config_hash": "b196e415cb8b7ef6f9091b05a4101873f0fd8390d51ce767a7c4f02a1474f4fe"
  }
}