{
  "version_esquema": "ModelQualityCase_v1",
  "generated_at_utc": "2026-02-22T18:04:33+00:00",
  "caso_id": "CASE_20260222_0327",
  "ticker": "0327",
  "fecha_caso": "2026-02-22",
  "coverage": {
    "votes_total": 1,
    "canonical_steps": 1,
    "per_model_entries": 0
  },
  "min_samples_per_step_model": 20,
  "per_model_step_stats": [],
  "fusion_comparison": [],
  "_meta": {
    "config_hash": "b196e415cb8b7ef6f9091b05a4101873f0fd8390d51ce767a7c4f02a1474f4fe"
  }
}