{
  "version_esquema": "ModelQualityCase_v1",
  "generated_at_utc": "2026-02-20T06:28:42+00:00",
  "caso_id": "CASE_20260212_GCT",
  "ticker": "GCT",
  "fecha_caso": "2026-02-12",
  "coverage": {
    "votes_total": 5,
    "canonical_steps": 4,
    "per_model_entries": 3
  },
  "min_samples_per_step_model": 20,
  "per_model_step_stats": [
    {
      "canonical_step_name": "CATALYST_DETECTION",
      "backend": "codex",
      "n_votes": 1,
      "mean": 100.0,
      "p25": 100.0,
      "median": 100.0,
      "p75": 100.0,
      "last_seen_utc": "2026-02-20T06:28:42+00:00",
      "sample_sufficiency": false,
      "rules_failed_top": []
    },
    {
      "canonical_step_name": "FORENSIC_DETECTION",
      "backend": "claude",
      "n_votes": 1,
      "mean": 64.28,
      "p25": 64.0,
      "median": 64.0,
      "p75": 64.0,
      "last_seen_utc": "2026-02-20T06:27:22+00:00",
      "sample_sufficiency": false,
      "rules_failed_top": [
        {
          "rule": "schema_valid",
          "count": 1
        }
      ]
    },
    {
      "canonical_step_name": "FORENSIC_DETECTION",
      "backend": "codex",
      "n_votes": 1,
      "mean": 66.3,
      "p25": 66.0,
      "median": 66.0,
      "p75": 66.0,
      "last_seen_utc": "2026-02-20T06:27:22+00:00",
      "sample_sufficiency": false,
      "rules_failed_top": [
        {
          "rule": "schema_valid",
          "count": 1
        }
      ]
    }
  ],
  "fusion_comparison": [],
  "_meta": {
    "config_hash": "b196e415cb8b7ef6f9091b05a4101873f0fd8390d51ce767a7c4f02a1474f4fe"
  }
}